Tweet;
family urging everyone stay date vaccinations losing infant son meningitis fourmonthold killy schultz died june hours developing rash spiking fever way home day care;
yaaaas hep tetnus diphtheria meningitis cholera yellow fever jags await rip arms;
threats pandemic influenza conflict cholera diphtheria malaria natural disasters meningitis yellow fever malnutrition food poisoning;
clogged sinuses lead various symptoms related issues headaches snoring difficulty breathing serious cases sinus infection may even lead brain fever meningitis tips clear sinuses;
had doctor tell friend ear infection fever something mild drink plenty sleep family trust diagnosis took found meningitis hospital week had surgery;
meningitis happen stages present initially encephopathy patients bacterial meningitis commonly present combination headache fever extremely pain flexing neck;
symptoms food poisoning diarrheanausea vomiting fever dehydration sore throat may lead abortion paralysis septic shock meningitis hemolytic uremic syndrome;
first symptoms meningitis fever headache day saw video girl lost meningitis even tho parents took hospital getting first symptoms bruh;
uh ok obviously fuckin hate getting shots much next person make arm swell usually have fever two three days u know lil fever better contracting meningitis measles whatever things;
have meningitis vaccine stages cause meningitis gives body tiny dormant dose easy immune system tackle baby get mild fever;
im sorry youre feeling well ash feel though got meningitis vaccine today give sore arm also fever lol common guess ill buddies though hands miserable one;
fever neck stiffness probably meningitis;
global network laboratories established global polio eradication initiative also tracks measles rubella yellow fever meningitis deadly infectious diseases;
global network laboratories established global polio eradication initiative also tracks measles rubella yellow fever meningitis deadly infectious diseases;
gov travel clinic cheapest yellow fever meningitis injections doctors;
infections common cold flu brain infections meningitis encephalitis skull fractures colorado tick fever malignant hypertension poisoning due black widow spider venom polio anthrax ebola virus;
slept bedside had mumps measles scarlet fever meningitis;
hell give examples burkina fassonwhere sankara managed remove meningitis measles yellow fever using wealth third world country greatest ruler country nature killed people third world countries;
lyme neroborrealis meningitis fever arthritis fog fun;
r u god pneumococcal meningitis infection tissue covering brain spinal cord symptoms stiff neck fever headache photophobia sensitive;
god pneumococcal meningitis infection tissue covering brain spinal cord symptoms stiff neck fever headache photophobia sensitive;
daycare eddies neck bothering have fever mind goes straight meningitis freaking;
little brother went walk fever called ambulance soon saw rushed hospital meningitis staff everything amazing starting gcses country owes everything;
hernia pneumonia repaired ribs bus crash burst appendix broken neck meningitis glandular fever mental health support diagnosis bipolar recently corrective surgery nose help breathe would without nhs;
dear thank everything have done birth viral meningitis glandular fever broken arms cheekbone nose ribs acl reconstruction shoulder surgery ongoing haemochromatosis mention childrens births various hospital thank x;
nhs saved year old daughters life contracted scarlet fever visiting doctor india suggested check secondary found meningitis strep kawaski syndrome would have died wasnt nhs treatment indian doc;
fda lassa fever chikungunya rabies cryptococcal meningitis priority review voucher program encourage drug development areas unmet need;
warning parents suspect baby might have please wait rash fever week old had trust instinct seek medical;
dr switzer correct pronged fever associated worse outcomes cognitive decline underlying condition thats problem have meningitis have fever infection damage fever;
found articles protest tuam think types ailments could have died scarlett fever tuberculosis strep throat polio smallpox meningitis measles mumps rubella;
years went urgent care w fever headache recent tick bite provider dismissive sent home days later admitted neuro unit via ed hospital w urgent lyme meningitis days later discharged home;
list tropical diseases priority review voucher program includes lassa fever chikungunya virus disease rabies cryptococcal meningitis;
worked closely member states partners contain outbreaks emergencies countries past year including viral haemorrhagic fevers rift valley fever;
neck stiffness nuchal rigidity fever suggest meningitis;
lassa fever chikungunya rabies cryptococcal meningitis fda adds four tropical diseases priority review voucher program encourage drug development areas unmet need;
had major fever come nowhere afternoon put bed seatofpants course sure heading death meningitis luckily had codeine stashed away rainy day;
viral meningitis poor wee sausage had fever wednesday nursery took v early thursday morning have since had cannula lumbar puncture has brave x;
fda has announced addition lassa fever chikungunya virus disease rabies cryptococcal meningitis list tropical diseases;
expanding lassa fever chikungunya rabies cryptococcal meningitis added fda tropical disease priority review voucher program;
sounds possible think abdominal migraines thing kids maybe check fever scary stuff like meningitis has similar symptoms;
fda adds four tropical diseases priority review voucher program encourage drug development areas unmet need lassa fever chikungunya virus disease rabies cryptococcal meningitis applicants submit applications drug biological;
today announced addition lassa fever chikungunya virus disease rabies cryptococcal meningitis list tropical;
chikungunya rabies cryptococcal meningitis lassa fever addsfourtropicaldiseasespriorityreviewvoucherprogram;
diseases transmitted rats include hantavirus hemorrhagic fever lassa fever leptospirosis meningitis tularemia wonder has rise diagnoses dc;
us food drug administration announced addition lassa fever chikungunya virus disease rabies cryptococcal meningitis list tropical diseases;
today added tropical diseases chikungunya cryptococcal meningitis lassa fever rabies list diseases treatments eligible priority review voucher heres complete voucher eligibility;
lassa fever chikungunya rabies cryptococcal meningitis added fda tropical diseases list us food drug administration announced today addition lassa fever chikungunya virus disease rabies cryptococcal meningitis;
fever cryptococcal added tropical diseases list;
fda fda adds four tropical diseases priority review voucher program encourage drug development areas unmet need oday us food drug lassa fever chikungunya virus disease rabies cryptococcal meningitis;
good news areas risk lassa fever chikungunya virus disease cryptococcal meningitis;
today announced addition lassa fever virus disease rabies cryptococcal list tropical diseases applicants submit applications drug biological products prevent treat may qualify priority review;
fda has added lassa fever chikungunya virus disease rabies cryptococcal meningitis list tropical diseases;
fda has added lassa fever chikungunya virus disease rabies cryptococcal meningitis list tropical diseases eligible priority review vouchers;
lassa fever virus disease rabies cryptococcal meningitis added list increasing opportunities bagging priority review voucher although suggested pneumocystis pneumonia didnt make list;
oh sorry thinking stress have fever meningitis;
currently have incountry capacity test epidemicprone diseases monkeypox yellow fever measles cholera lassa fever cerebrospinal meningitis years ncdc;
maybe accompanied fever symptoms could meningitis;
yeah may ok attached high fever headache something virus went neck called meningitis;
went doctors get check leave school get meningitis shot have severe reaction fever shakes aches toxic huco want leave im trooper tho see tomorrow sag;
daughter perfectly healthy measures got dtap morning had hospitalized evening high fever fullbody rash weight swelling spinal tap rule meningitis ultimately days hospital explanation;
had yr old many yrs ago fever crying looked good cbc unremarkable told family call anything seems wrong had pneumococcal pneumonia meningitis have;
extremely proud feat welldone team currently have incountry capacity test epidemic prone diseases monkeypox yellow fever measles cholera lassa fever cerebrospinal meningitis;
im hot blooded check see got fever hundred three come baby lets get meningitis control first handsome;
researching family history constant lesson diseases longer fear due immunizations better medical care ive seen deaths smallpox consumption diphtheria yellow fever meningitis influenza malaria;
hi im someone elses house think meningitis vaccine gave fever;
tetanus shots every ten years past two times ive gotten pretty much side effects also good news also got meningitis b vaccine along fever aches chills also cant move left arm;
anyone else get sick meningitis have had fever since last night ° day;
ebola lassa fever malaria pdp tuberculosis meningitis killer disease;
go get could probably get another meningitis rabies yellow fever experimental could probably sign trial new vaccine never;
year haj held shadow recently documented outbreaks cholera ebola polio measles mers meningitis yellow fever nd hepatitis;
go get could probably get another meningitis rabies yellow fever experimental could probably sign trial new vaccine never;
bacterial meningitis infection central nervous system patients type infection may present headache fever altered mental status neck;
valley fever meningitis essential oils testimonial líder toni;
omgoodness symptoms include headaches muscle aches fever also include pulmonary hemorrhage kidney failure meningitis leptospirosis suspected northern water sources;
west nile fever viral infection typically spread mosquitoes infections people have symptoms people develop fever headache vomiting rash less people encephalitis meningitis occurs;
dont think could would ever give advice wasnt pitch fever think sepsis really bad miss meningitis tingling little act;
hepatitis b yellow fever typhoid rabies meningitis top head ones had;
think pancreatitis benign say recover quickly could say many many things malaria ebola yellow fever measles smallpox spanish flu meningitis mercury toxicity;
people get get viral meningitis get encephalitis men mumps get swollen testicles get fever headache swollen salivary glands jaw doses needed protection;
fantastic grand rounds cpc discussion dr marc robinson presentation patient dialysis fever headache found have cryptococcal meningitis special thanks nico herrera dr hamill contributions;
wnv pearls hallmark neuroinvasive ssx flaccid paralysis meningitis myoclonus common wnv cause viral enceph fever measleslike rash present risk neuroinvasive;
symptoms west nile virus include fever confusion muscles weakness severe headache serious complications include neurological illnesses meningitis encephalitis;
symptoms west nile virus include fever confusion muscles weakness severe headache serious complications include neurological illnesses meningitis encephalitis;
patients reported central nervous system symptoms netherlands norway united kingdom reported meningitis meningitis one patient sepsis fever tachycardia groaning respiration;
great said diphtheria hepatitis b measles meningitis mumps pertussis polio rubella tetanus tuberculosis yellow fever;
diseases easily cured controlled have killed many nigerians buhari lassa fever cholera meningitis still see need cabinet reshuffle telling vote buhari want know reinforcing needless deaths;
common health risks country includes cholera dengue fever dysentery hepatitis malaria meningitis areas typhoid travellers respiratory ailments may wish take precautionary measures;
back still fucked spinal tap thursday plus side least have meningitis unfortunately have bacteria viral fungal infection cause illness undetermined idiopathic fever minor swelling brain lupus flare;
seal nigerians borders immediately lassa fever meningitis intractable capäble minister health talk ebola incompetence world;
rt rash often ultimate symptom following fever feeling unwell requiring immediate medical attention;
travelling later year need protection lot typhoid tetanus meningitis acwy yellow fever hepatitis hepatitis b cholera malaria unsurprisingly said yes please vaccinations chemoprophylaxis anti vaxxers;
anyone guess originally isolated streptomyces nodosus may used treat cryptococcus meningitis typically injected iv linked fever chills hypotension soon administration causes hypokalemia;
ala baru viral fever belum meningitis;
mosquito virus people develop symptoms may have fever headache vomiting diarrhea rare cases people develop severe illnesses like meningitis deadly;
causes swollen neck glands fever people get get viral get men have mumps get swollen testicles get fever headache swollen salivary glands jaw get;
treated vast majority deaths caused cerebro spinal fever odd case meningitis scarlet fever pneumonia soldiers uk australia new zealand canada info maps website;
asymptomatic urti خشة gastroenteritis خشة myocarditis مشية aseptic meningitis مشية fever وهوا في الطريق الدم;
الكيسات مش صعبة بحد ذاتها المشكلة بال check list تاعتهم بدهم اشي محدد تسألي عنه ما بتعرفي شو هو ، اجانا knee pain swelling fever periorbital edema nephrotic syndrom meningitis febrile convulsion مش عارف بالضبط;
immunisations have changed since oldest two added meningitis b letter says have give calpol high risk fever couldnt remember applied week ones x;
bacterial meningitis cause inflammation brain according centers disease control prevention symptoms include fever headache stiff neck;
person lassa fever meningitis give jihad indeed dodged bullet;
people handle lasa fever cholera meningitis;
exactly lassa fever cholera meningitis have intractable politician health minister;
difficult diagnose first many symptoms including high fever vomiting similar many lessserious ailments;
bacterial meningitis cause inflammation brain according centers disease control prevention symptoms include fever headache stiff neck nstateofficialsconfirmcaseofbacterialmeningitis;
kesian jugak ada fever hosp dalam negeri seluruh case hiv hbv hcv tetanus meningitis rabies dlm sebuah negeri cuma refer ke fever hosp cannot brain doctor yg kena hadap;
hope have go back head neck hurting severely coughing bit back pain fever have viral meningitis something maybe worrying slight;
father died suddenly known cause death has haunted every year since heart ruptures fever fear vascular eds based unknown medical history gp working get testing info recently learned meningitis poss culprit;
yes sorry must have frantic childs fever high really know sure ear issues go meningitis;
said child high fever one day would urgent care let alone er risk meningitis;
assessment blood enterovirus pcr testing paediatric populations fever without source sepsislike disease suspected meningitis prospective multicentre observational cohort study;
dc fever infection meningitis lp abg;
dc fever infection meningitis lp abg;
yes also fever respiratory symptoms meningitis could eat poop pee ptosis open inflamed eyelid muscles bottom right part neck past right elbow affected;
sadly africas rhinos endangered ever china weakens ban rhino horn trade allow socalled medical use cure fever gout insomnia meningitis even without scientific evidence rhino parts cure anything;
course last couple years had spate biological threats said lagos state health commissioner olajide idris listing ebola lassa fever meningitis monkey pox;
rhino tiger parts highly valued traditional chinese medicine prescribed treat large variety ailments including fever gout insomnia meningitis though benefits have proven;
sorry sucks have persists fever headache nausea may want go merg get tested meningitis hope flu pulled;
special types fever fever rigors eg malaria abscess septicemia fever herpes labialis eg pneumonia meningitis fever rash eg measles rubella typhus fever membrane throat eg diphteria agranulocytosis fever delirium eg encephalitis;
please read forward last february year old had exposed viral meningitis know symptoms mild flu like spiked degree fever miserable fever;
has slightly stiff neck having fever night meningitis youre dying google things;
hospital anyone undiagnosed fever goes checkup basically feh el meningitis rabies name;
looking health system pmbwould have survived ebola happen answercheck handled outbreak lassa fever meningitis polio;
complications include viral swollen testicles fever headache swollen salivary glands jaw way prevent mumps getting vaccines time visit immunisationie information;
desperate daughter hindu terror parineeti shinde calling pm dengue think congress has brain fever meningitis;
thought had meningitis kind brain fever;
old sister year old fine treated time baby parents didnt know thought had fever age have had main booster meningitis even one child town multiply;
have many stories tag fact suspected hearing loss due meningitis get treated properly parents told doctors could hear basically kid messing around even though had high fever;
might have see vinnies feeling anyways coming meningitis jab might give fever;
mild disease vaccine small pox measels mumps rubella flu polio meningitis pneumonia diphtheria pertussis tetanus whooping cough hepatitis chicken pox herpes syphilis ebola scarlet fever yellow fever malaria dengue fever kill;
see old daughter fighting isolation hospital ° c fever stay weak weeks pray turn meningitis like forgot vaccine egg compartment fridge;
crowned dens syndrome crystalline arthropathy often present mimicking meningitis fever neck stiffness often leading lps;
went persistent really bad headache really high fever essentially three teams doctors have arguing whether give another spinal tap several days lol theyre discharging rule meningitis mess;
causes fever almost infection cause fever bone infections appendicitis skin infections cellulitis meningitis respiratory infections;
aq tiap tahun pulang indo vaksin ulang di sini vaccine flu yellow fever meningitis;
oh great boff told coral cut lead meningitis get fever days die;
have fever husband has made paranoid might have meningitis get married kids;
googled symptoms turns have spinal meningitis hay fever depression;
lets see matches reality snf placement massive stemi knee consult varicella meningitis acute osteo foot neutropenic fever real nothing actually wrong;
unvaccinated allowed carry pneumococcal meningitis dengue fever malaria yellow fever anxious carrying honduran;
born blind deaf contracted either scarlet fever meningitis months developed soon;
immunizations yellow fever cholera polio booster typhoid malaria af travelers diarrhea rx already good flu meningitis gonna sore;
seriously think good general note fever floppy head meningitis joke either;
said people dont get symptoms get fever cough worse cases meningitis brain cord gets inflammed encephalitis brain gets swollen;
let say headache having bacterial meningitis like laying dark crying could turn lights cause bright could barely walk aunt found bed fever;
sir mother admitted headache fever doctor said migraine start treatment days mother feels well discharge days suffering headache decide go neurologist said meningitis;
lk think have meningitis bc ive had neck killing w side fever;
parents opt vaccinations kids perhaps think kids come unnecessary diseases look ma have measles whooping cough mumps meningitis scarlet fever influenza chicken pox;
symptoms viral meningitis include fever severe headache stiff neck sensitivity bright lights drowsiness confusion nausea vomiting;
thomas sankara vaccinated million children meningitis yellow fever measles matter weeks taking power;
domestic policies focused preventing famine agrarian selfsufficiency land reform prioritising education nationwide literacy campaign promoting public health vaccinating children meningitis yellow fever measles;
ewashinge eyoure eheandese clean ewatere eande soap protect hepatitis e common cold econjunctivitise meningitis pneumonia ediarrheae lassa fever ebola intestinal worm infestation;
meningitis b safe vaccine often reported low fever local reaction reports headache malaise fatigue unclear actual serious permanent side effects safety signals seen;
meningitis b many people carry enters bloodstream disseminates cause harm rapid illness early fever headache stiff neck deteriorates fast dangerous fatality meningitis;
called mom tell neck hurts have fever tell said have meningitis like im hypochondriac please tell medicine go buy;
however know prophet peace upon left world experiencing headache fever shortly received poison nobody knows related meningitis specific disease rely weak evidence;
pakistan two children teen die meningitis ry khan least three people including two children teen died suffering meningitis fever rahim yar khan friday;
people get get viral meningitis get encephalitis men have mumps get swollen testicles get fever headache swollen salivary glands jaw prevention better get doses immunisationie;
epidemic hazard pakistan least three people including two children teen died suffering meningitis fever rahim yar khan friday doctors sheikh zayed hospital told express news rsoe edis;
rsoe edis event report least three people including two children teen died suffering meningitis fever rahim yar khan friday doctors sheikh zayed;
jaxson parents got done speaking fever symptoms still meningitis hits day fever possibly testing something called kawasakis please pray continued healing sweet son;
data provided nbs shows things least times bad years ago look deaths meningitis lassa fever clashes flooding decade had bad had state emergency education;
cant believe year ago today hospital wired drip meningitis glandular fever;
causes swollen neck glands fever people get get viral get men have mumps get swollen testicles get fever headache swollen salivary glands jaw get;
minta disuntik yellow fever malah disuntik meningitis;
aware get fever meningitis shot feel like crap;
steady fever like days youre fine neck hurts dont feel good omg maybe have meningitis;
know detail patients gps really hard prioritise weigh whether see child fever rash meningitis self harming teenager suicide middle aged person back pain first;
moot girl meningitis discharged hospital minjone muller admitted hospital free state started getting headache high fever read;
meds give had meningitis had degree fever gave penicillin;
still have fever going hospital illness feels like meningitis described;
typhus typhus fever fleaborne infectious disease cause high fever headache chills body aches rashes rare cases meningitis death;
done ridiculously hard run miles remembered last days ive inoculated hepatitis tetanus diphtheria polio yellow fever flu meningitis rabies reflection bad;
clogged sinuses lead various symptoms related issues headaches snoring difficulty breathing serious cases sinus infection may even lead brain fever meningitis tips clear sinuses;
also could have fever could infection meningitis headache could wisdom teeth;
amoeba releases toxins proteases digest brain tissue producing focal liquifaction brain tissues symptoms similar meningitis sore neck fever seizures change personality many cases initially assumed bacterial viral;
referring infection specific pathogens cause fever meningitis encephalitis;
wrong fever inducing agents possibly lead meningitis encephalitis;
everytime one kids gets high fever like lightning likely strike twice coming months bacterial;
fever actually reaction infection cause encephalitis meningitis;
brickhead could assert fever avoided encephalitis meningitis causing injections;
waterborne rattus rattus – spirochete leptospira grippotyphosa causes fever general malaise aseptic meningitis coughing atypical presentation;
child may vomit number reasons viral infection motion sickness food poisoning fever overeating make child throw also vomit suffer serious conditions meningitis appendicitis intestinal blockages;
conjunctuvites media olitis acute rhumatuc fever pneumonia meningitis pyoderma diphtheria antherax tb gonorrhea vomitting gnf toxic shock syndrome scarlet fever atypical pneumoniae q fever tetanus scaled skin syndrome rush tonsillar diphtheria endocarditis;
getting vaccinated yellow fever hepatitis typhoid meningitis things travel;
assessment blood enterovirus pcr testing paediatric populations fever without source sepsislike disease suspected meningitis prospective multicentre observational cohort study lancet infectious diseases yes;
since buhari took lassa fever spread killed thousands polio returned north meningitis outbreak yellow fever resurfaced zika fever monkey pox introduced nigerians getting killed fulanis poverty disease daily;
yellow fever years need have yellow fever meningitis card;
image pneumococcal bacteremia meningitis man asplenia presented confusion fever headache grams stain blood csf revealed abundant grampositive cocci pairs chains;
image pneumococcal bacteremia meningitis man asplenia presented confusion fever headache grams stain blood csf revealed abundant grampositive cocci pairs chains;
image pneumococcal bacteremia meningitis man asplenia presented confusion fever headache grams stain blood csf revealed abundant grampositive cocci pairs chains;
