Tweet;
supposed go hospital have fever stiff neck make sure meningitis;
experts warning doctors may miss correctly diagnosing babies deadly bacterial may assume infants without fever classic sign disease have illness;
signs bacterial meningitis babies often nonspecific half have fever common features include poor feeding lethargy irritability bacterial meningitis needs considered diagnosing sick babies fever;
young babies meningitis have fever meningitis research foundation arningonlyaroundhalfofyoungbabies;
study finds around half young babies meningitis present fever says decades fever has major trigger medical investigation;
urgent experts predict around half young babies meningitis present fever decades fever has major trigger medical investigation find arningonlyaroundhalfofyoungbabies;
love little brother had rash fever took walk phoned ambulance rushed hospital meningitis nurses doctors everyone amazing weeks;
want bit help yellow fever meningitis apply senior programme manager role;
leptospirosis farmers abattoir workers veterinarians recreational activities acute fever muscle pain lumbar calf redness conjunctiva occasionally aseptic meningitis gi symptoms infrequent;
would rather want news meningitis outbreak niger state nigeria lassa fever has killed many health personell cholera malaria diarrhoeal dsxs killing nigerians dig deeper keep us abreast;
ugh bless heart im glad meningitis sure hope scarlett fever passes soon;
wife thought son had symptoms meningitis took er tonight left game immediately told good meningitis bad dude has scarlett fever;
meningitis inflammation protective membranes covering brain spinal cords causing headache fever stiff neck rare resulting fewer cases per year spread airborne droplets usually shortterm;
natural infections meningitis whooping cough pneumonic plague ebola cholera dengue haemorrhagic fever tuberculosis influenza tetanus natural potentially deadly like measles prevent many vaccination rant;
meningitis pneumococcal bacteremia among infants fever without known source introduction pneumococcal conjugate vaccine basque country spain;
news around continent cholera outbreak cerobrospinal meningitis outbreak fresh lassa fever outbreak edo leaders au quick debunk trumps comments instead fixing;
have lassa fever have meningitis have terrorist herdsmen have bh problem yusuf buhari dead alive;
facial weakness diplopia fever atypical case tuberculous meningitis abstract;
pandemic influenza health conflict cholera diphtheria malaria natural disasters meningitis yellow fever malnutrition food poisoning threats likely face;
facial weakness diplopia fever atypical case tuberculous meningitis;
meningitis inflammation meninges characterized headache neck stiffness photophobia also fever chills vomiting myalgia;
ago today completed vaccinations preparation around world trip hep b japanese encephalitis rabies meningitis cholera yellow fever days away putting notice work;
weeks acquaintance mine complained stiff neck fever migraines selfmedicated painkillers never got better suspected meningitis yestrdy suggested lumbar puncture da results confirmed suspicion wish speedy recovery;
fever lasted solid days told big meningitis scare sick days wanna end feel hope get well soon xxxxx;
mostly preventable vaccines flu cholera diptheria malaria meningitis yellow fever dengue;
point never know impact words daughter wouldve died spinal meningitis hadnt known fever baby months life threatening keep;
meningitis get serious quickly seek medical care experience high sudden fever severe headache stiff neck nausea vomiting;
meningitis inflammation membranes surrounding brain spinal cord swelling meningitis triggers fever stiff neck cases meningitis caused viral infection bacterial fungal infections causes;
happened may savannah fever extreme headache body aches may next day rushed back hospital convulsing diagnosed meningococcal meningitis;
had treatment bradford fever hospital meningitis;
increasing investment vaccinesmeasles hep b hpv yellow fever hibpneumonia rotavirus rubella meningitis encephalitis low middleincome countries could avert deaths keep people poverty;
good know apis works anaphylaxis isnt remedy section though dysmenorrhea headache infertility meningitis cellulitis asthma scarlet fever shingles name;
higher fever sicker must really fact really matter high fever isthe last meningitis case saw kids temperature says dr al sacchetti;
fever congestion brain meningitis children gels;
conned uganda booked speak silently dropped had jabs typhoid hepatitis b cholera yellow fever rabies meningitis flu waste £ cost else has want go flaunt immunity;
gavi has helped developing countries prevent future deaths support pentavalent pneumococcal rotavirus yellow fever meningitis japanese encephalitis measles rubella;
influenza health conflict cholera diphtheria malaria natural disaster meningitis yellow fever malnutrition food poisoning global health threats;
virus causes fever headaches swollen salivary glands jaw children may develop mild meningitis sometimes encephalitis result permanent hearing loss serious complications result adults teenagers esp males get mumps;
another scarlet fever article mention similarity symptoms meningitis remember;
cholera diphtheria meningitis c yellow fever — vaccine preventable global health;
nigerians facing lassafevermalariaaids meningitis yellow fevermonkey fever etc;
meningitis bad bad bro had ever since whenever us runs high fever chin check;
had rash hands yesterday convinced had either shingles scarlett fever meningitis turns dry skin hahahaha;
shape pyramid nigeria shows majority population immune currently circulating infectious threats fever cholera meningitis monkey pox lassa risk amplification high;
big mood im even like hypochondriac almost died meningitis get fever get fuckin manic terrified;
condoms wonderful preventing pregnancies reduce probability stds never prevent trust caught early easier treat tonsillitis keeps days bed ° c fever need hpv meningitis jabs neisseria gonorrhoeae;
common signs symptoms meningitis septicaemia fever cold hands feet vomiting drowsy difficult;
said sick time had meningitis spinal tap pulled fluids had influenza scarlet fever didnt go;
probably shld ask aggressive vaccination campaigns far hepatitis b like has polio yellow fever meningitis;
due puerperal fever bacterial infections measles whooping cough scarlet fever diptheria tetanus polio rubella meningitis tuberculosis;
had reply discharge had tropical lyme disease positive borrelia positive patient also had viral meningitis glandular fever encephalitis argument greece flew home tropics theve learnt choice words;
have someone utsouthwestern bring gigantic bag vaccines ryans supporters suggest smallpox measles mumps hepatitis meningitis bubonic plague pneumonic plague pneumonia typhus yellow fever anthrax flu polio;
rt real epidemics ones deal daily basis diphtheria measles cholera yellow fever meningitis dr mercedes tatay many vaccine;
real epidemics ones deal daily basis diphtheria measles cholera yellow fever meningitis dr mercedes tatay many vaccine;
flu vaccine pertussis yellow fever brazil listeria south africa family meningitis spread finland slovakia;
health meningitis symptoms include sudden onset fever headache stiff neck symptoms include confusion student experiences symptoms immediately report pitts student health service hospital er;
difficult distinguish symptoms infectious diseases malaria typhoid fever meningitis viral diseases;
things probably know thomas sankara former president burkina faso – vaccinated million children meningitis yellow fever measles matter weeks –;
early today found mary little house books probably go blind scarlet fever probably meningitis whole world feels like lie;
scarlet fever awareness although cases mild children adults become sick scarlet fever left untreated long enough infection spread blood cause bacteremia pneumonia sepsis meningitis rare;
illegals tents refugees place peeing pooping wherever want im surprised cholera malaria meningitis bubonic plague typhus dengue fever california must also showing signs diseases;
symptoms include high fever coughing apparently due complications strep throat meningitis brain pneumonia toxic shock syndrome;
babies young children highest risk donate wonderful charity experts around half young babies meningitis display fever meningitis research foundation arningonlyaroundhalfofyoungbabies;
had strength survive roll someone tuberculosis dysentery malaria typhoid fever diphtheria meningitis whooping cough scarlet fever afflictions;
kids get meningitis fever suppression;
aun health center vaccinates tetanus yellow fever hepatitis meningitis;
needed get gardasil twice since school have record pediatrician moved anything second time either also have reaction got typhoid hep cholera yellow fever rabies meningitis influenza vaccines africa;
ancestors lived longer us based survey conducted wishful historical ancestors have drugs small pox lassa fever meningitis malaria etc;
mohon bantuannya ada yang tau gak rumah sakit yg buat vaksin yellow fever dan meningitis di;
mohon bantuannya ada yang tau gak rumah sakit yg buat vaksin yellow fever dan meningitis di;
central nervous system infections may present fever headache nausea vomiting lead seizures best initial treatment bacterial meningitis ceftriaxone vancomycin steroids;
way sounds like meningitis dont have fever bad yet im hoping nothing serious im allowed step musical;
advises nigeria others wary listeriosis outbreak boko herdsmen kidnappers armed robbers nass members lassa fever meningitis one wary;
notice toddlers loss apetite fever difficulty waking adults high fever vomiting neck stiffness might case report immediately urgent response learn appalertcliniccom;
dr meningitis dx poor sensitivity fever stiff neck ams had classic triad fever had least add ha none move;
woke january severe ache lower back fever headache would go tablets;
looking published data patients bacterial meningitis have fever;
worsening advice symps absence fever together absence altered mental state likely meningitis good;
britons protecting diseases like yellow fever meningitis chickenpox;
britons protecting diseases like yellow fever meningitis chickenpox;
knows fever dream mixed meningitis;
fever complaint headache many parents often worried meningitis well wasnt;
signs include high fever stiffness neck headache vomiting early reporting critical notice signs avoid selfmedication go immediately nearest health facility;
symptoms listerioses include diarrhea fever headache muscle pain septicemia meningitis prevention listeriosis similar guidance used help prevent foodborne illnesses includes practicing safe food handling;
fever got had hallucinations tremors had sedated intubated could lumbar puncture rule meningitis;
diseases transmitted handshakes lassa fever ebola meningitis hepatitis conjunctivitis typhoid fever shigella genital herpes people have died handshakes maintain hand hygiene use hand sanitizers wash hands frequently;
بيجي المريض pe بطلع wilson disease بيجي عنده cough بطلع colchicine overdose بيجي fever بطلع anthrax بتيجي meningitis بتطلع ovarian ca واي ؟;
doc called aseptic meningitis want fight like have flu low fever gonna push today get better;
stop lassa fever meningitis diseases killing nigerians ncdc ceo;
stop lassa fever meningitis diseases killing nigerians – ncdc ceo;
stop lassa fever meningitis diseases killing nigerians – ncdc ceo;
stop lassa fever meningitis diseases – official eriawhatweredoingtostoplassafevermeningitisotherdiseases;
cross calapharm produce meningitis lassa fever vaccine;
stop lassa fever meningitis diseases killing nigerians – ncdc ceo;
stop lassa fever meningitis diseases killing nigerians – ncdc ceo;
stop lassa fever meningitis diseases killing nigerians – has published;
stop lassa fever meningitis diseases killing nigerians;
criver calapharm produce meningitis lassa fever vaccine joseph kingston calabar cross river state pharma ­ ceutical company cala ­ pharm;
criver calapharm produce meningitis lassa fever vaccine joseph kingston calabar cross river state pharma ­ ceutical company cala ­ pharm;
wearewere stop lassa fever meningitis diseases – official;
cross calapharm produce meningitis lassa fever vaccine;
wearewere stop lassa fever meningitis diseases – official;
stop lassa fever meningitis diseases;
stop lassa fever meningitis diseases official;
new post stop lassa fever meningitis killing has published businesstorch news;
stop lassa fever meningitis diseases killing nigerians – ncdc ceo;
stop lassa fever meningitis diseases killing nigerians – ncdc ceo;
stop lassa fever meningitis diseases killing nigerians ncdc has published latest nigeria news;
stop lassa fever meningitis diseases killing nigerians – ncdc ceo;
stop lassa fever meningitis diseases killing nigerians – ncdc ceo;
stop lassa fever meningitis diseases killing nigerians – ncdc ceo;
stop lassa fever meningitis diseases killing nigerians – ncdc ceo nigeria centre disease control boss explains agency check spread diseases post stop las;
stop lassa fever meningitis diseases killing nigerians – ncdc ceo;
stop lassa fever meningitis diseases killing nigerians – ncdc ceo;
cross calapharm produce meningitis lassa fever vaccine;
take beta blocker high blood pressure already work pretty well worst migraine had had like years also had fever neck stiffness doc concerned meningitis ultimately didnt think necessary;
calapharmll produce meningitis lassa fever vaccine commissioner via;
calapharmll produce meningitis lassa fever vaccine – commissioner;
cross river produce vaccines meningitis lassa fever;
flu cold fever strep throat meningitis chik v sinuses viruses naaaaaaame;
expert warns selftreatment headache fever especially hot season could fatal meningitis presents similar symptoms advised people seek professional advice instead selfmedication read ghsu;
travel clinic phone call took minutes much go get go next week yellow fever injection new meningitis injection balls;
completed annual flu paranoia ritual woke fever headache spent hours feeling convinced had meningitis going die took excedrin felt better fin;
meningitis expert cautions self treatment headache fever;
meningitis expert warns self treatment headache fever;
meningitis expert warns selftreatment headache fever eagle online;
meningitis expert warns selftreatment headache fever;
meningitis expert warns selftreatment headache fever;
meningitis expert warns self treatment headache fever;
meningitis expert warns self treatment headache fever;
meningitis expert warns self treatment headache fever;
meningitis expert warns self treatment headache fever;
meningitis expert cautions self treatment headache fever via cargohubng;
meningitis expert cautions self treatment headache fever;
meningitis expert warns self treatment headache fever gainstselftreatmentofheadache;
meningitis expert cautions self treatment headache fever ontvsitecom;
meningitis expert warns self treatment headache fever;
meningitis expert warns self treatment headache fever;
meningitis expert warns self treatment headache fever;
meningitis expert warns self treatment headache fever tisexpertwarnsagainstselftreatmentofheadache;
dentist ignored unusual severe headache fever etc er rule meningitis prayers needed;
meningitis tumbler test first thing today plus usual checks major probs apart rash fact others have scarlet fever confirmed unlikely coincidence rash looks like scarlet fever;
hate neurotic stupid shit had fever last night feel bit shaky tired limbs feel kinda heavy have fever though right sure have either flu meningitis shit lmao;
new emergency operations center has responded lassa fever meningitis cholera ebola first year operation see full;
budgetary allocation healthcare backdrop recent outbreaks lassa fever measles meningitis fight end polio high maternal child deaths;
hooked ran test doctors came confirm meningitis little serious time around much could would could bring fever;
meningitis doctors tell us get vaccinated safety boy died vaccine fatality vaccine homeopathy saferr protection always have homeopathic belladonna fever nageboydiesfrommeningitisonlymonthsafterreceivingvaccinehtml;
have fever gc thinks dramatic yall gonna realllll mad have passed meningitis;
listeriosis symptoms flulike first – fever ‚ muscle aches ‚ diarrhoea – bacterium gets nervous system ‚ become meningitis like ‚ including severe headache ‚ sore neck ‚ convulsions ‚ confusion loss balance;
research funded has found around half babies meningitis display classic symptom fever result cases bacterial meningitis babies may missed;
experts warning doctors may miss correctly diagnosing babies deadly bacterial may assume infants without fever classic sign disease have illness;
fevers caused malaria symptoms fever vomiting result;
scientists st georges university london noted fever long considered key symptom bacterial meningitis reported per cent cases;
health lassa fever listeriosis outbreak meningitis heavy metal poisoning cholera outbreak have contained despite huge amount funds released alternate strategy govt adopting contain spread since previous strategy;
hurt wtf wrong child na tonsillitis adulthood always coming like meningitis fever neck stifness headache hot potato voice difficulty swallowing throat pain like;
has long gestation period days symptoms apparent flulike first fever muscle aches diarrhoea gets nervous system much severe meningitis like severe headache sore neck convulsions;
lowgrade fever back neck course could help google meningitis first thing pop yeesh;
headache fever malaise muscle pain bacteria cause meningitis causing stiffneck confusion severe headaches may may cause diarrhoea;
woke sore throat nose stuffy think have fever neck hurts meningitis;
lassa fevermonkey poxyellow fever meningitis;
common symptoms meningitis includes high fever headache vomiting stiff neck dislike bright lights children also become drowsy unresponsive sometimes may experience fits seizures;
had glandular fever child took ages diagnosed had have lumbar punctures rule meningitis mind take feel better x;
experts warning doctors may miss correctly diagnosing babies deadly bacterial meningitis may assume infants without fever classic sign disease have illness;
around half babies three months age have bacterial present fever has decades trigger medical investigation warn uk researchers;
never had fever had headache pressure behind eyes fluid right ear thought had meningitis;
experts warning doctors may miss correctly diagnosing babies deadly bacterial meningitis may assume infants without fever classic sign disease have illness;
vincent schiavelli tracey walter episode wkrp nice treat dying couch hay fever meningitis whatever killing;
shots hepatitis hepatitis b meningitis polio tetanus yellow fever prescriptions travelers diarrhea malaria operation democratic republic congo mckinley united;
calling wise owls please pray sisters friend natis mom has viral meningitis fever coming also nats sick son riley waiting see receive;
dont say meningitis unless have fever try magnesium mg po tylenol heat work;
realize vaccinations mean better have fever have meningitis something;
called septicemia first thing thought had fever fatigue headache unable move neck meningitis kill young healthy people really fast means call midwife needs tread carefully love barbara;
us stockpile management lassa fever nigeria meningitis b vaccine progress;
dr tb meningitis often has focal neurologic symptoms cranial nerve palsies hemiparesis think tb patient headache fever neck stiffness focal neurologic symptoms;
able recognise symptoms meningitis crucial symptoms fever rash vomiting headache stiff neck sensitivity light drowsiness comomeningitisorg have planned lot activities around raising awareness meningitis;
vaccinated million children meningitis yellow fever measles matter weeks;
meningitis inflammation membranes around brain spinal cord called meninges common symptoms include fever stiff neck severe headache eye sensitivity vomiting extreme sleepiness confusion have questions reach pediatrician;
oh hey have fever pretty high one since normal body temp may explain least pain haz idea meningitis alien;
world meningitis day learn recognize symptoms headache fever stiff neck first hours crucial;
signs meningitis fever seizures neck pain photophobia headaches infants signs may high pitched cry appetite bulging fontanele knowing signs symptoms save lives;
common symptoms meningitis include stiff neck high fever sensitivity light confusion headaches vomiting read;
today world meningitis day meningitis serious think child exhibiting symptoms like high fever bluish skin color stiff sore neck make appointment pediatrician right away;
today world meningitis day meningitis serious think child exhibiting symptoms like high fever bluish skin color stiff sore neck make appointment pediatrician right away;
today world meningitis day meningitis serious think child exhibiting symptoms like high fever bluish skin color stiff sore neck make appointment pediatrician right away;
today world meningitis day meningitis serious think child exhibiting symptoms like high fever bluish skin color stiff sore neck make appointment pediatrician right away;
today world meningitis day meningitis serious think child exhibiting symptoms like high fever bluish skin color stiff sore neck make appointment pediatrician right away;
today world meningitis day meningitis serious think child exhibiting symptoms like high fever bluish skin color stiff sore neck make appointment pediatrician right away;
today world meningitis day meningitis serious think child exhibiting symptoms like high fever bluish skin color stiff sore neck make appointment pediatrician right away;
today world meningitis day meningitis serious think child exhibiting symptoms like high fever bluish skin color stiff sore neck make appointment pediatrician right away;
today world meningitis day meningitis serious think child exhibiting symptoms like high fever bluish skin color stiff sore neck make appointment pediatrician right away;
today world meningitis day meningitis serious think child exhibiting symptoms like high fever bluish skin color stiff sore neck make appointment pediatrician right away;
today world meningitis day meningitis serious think child exhibiting symptoms like high fever bluish skin color stiff sore neck call doctor get;
would know red flag symptoms babies young children fever severe headache stiff neck confusion cold hands feet later stages rash seek urgent medical attention;
meningitis hard recognize early stages symptoms similar common flu main symptoms look fever vomiting headache stiff neck sensitivity light drowsiness altered consciousness;
like small pox scarlet fever polio meningitis tetanus ect better;
guessing meningitis meningitis fever cough rash headache neck stiffness;
although head splitting oh cough fever horrible headache tell barbara have meningitis;
vedika back hospital reports infant has diagnosed viral fever confirmed meningitis ailments went child awake groggy hungry active fever had subsided ward night watch alert recurrence sairam;
wht u rule meningitis viral cerebral fever scorching signs hypovolemic;
cranialsacral therapist concerned fighting could meningitis have symptoms except fever told take easy weekend;
tubercular meningitis hydrocephalus fever convulsions apis;
nigeria malaria strickenaids stricken meningitis strickenlassa fever stricken etc etc;
daughter diagnosed meningitis age month starting college thankfully bacterial ill got glandular fever recuperating ended ill year positive result x;
have bacterial strain meningitis doctor may immediately prescribe antibiotics like have viral strain take otc meds fever drink plenty fluids rest;
got sick beijing high fever headache fatigue worried meningitis wife going clinic ughhhhhnnng look terrible know bad could die know;
africa learn uganda newly commissioned continental study selected pathogenic diseases including ebola marburg meningitis lassa fever concluded sometime next year;
meningitis anamnestic fever diarrhoea vomiting purpuric rash;
evaluation booster dose pentavalent rotavirus vaccine coadministered measles yellow fever meningitis vaccines malian infants rotavirus vaccines given infants safe efficacious booster dose rotavirus;
people talking cadillac benefits summers former teacher exposed norovirus meningitis tb scarlet fever summers coworkers worked several jobs make ends meet buying supplies please tell;
disease mumps spread air person person cause swelling face fever meningitis occasionally vaccinate children mmr vaccine today protect;
several outbreaks ve occured year like never nigeriacerebrospinal meningitis lassa fever yellow fever cholera recently monkeypox lassa fever;
think epidemics think uganda yellow fever belt meningitis belt viral hemorrhagic fevers next congo basin think safe using tech improve outbreak surveillance;
cholera meningitis lassa fever etc killing nigerians buhari health sector has moved worse;
press uganda commenced pilot study epidemic insurance funding initiative implement outbreak insurance pilot study selected pathogenic diseases ebolamarburg meningitis lassa fever;
gas vs gbs similarity produce bhemolysis gram positive cocci chains treated penicillin gas spyogenes transmitted respi droplets eg strep throatimpetigorheumatic fever gbs sagalactiae gi reproductive tract eg neonatal meningitis sepsis;
