Tweet;
bacterial meningitis flu start fever malaise progress respiratory distress failure meningitis rare deadly mimics flu added symptoms severe headache stiff neck;
first black champion left coma meningitis woke discover life ring wasnt fight had begun;
signs bacterial meningitis babies often nonspecific half have fever common features include poor feeding lethargy irritability bacterial meningitis needs considered diagnosing sick babies fever;
ronald dlamini first black mixed martial arts champion south african history life changed got meningitis woke days coma found had become blind helps blind people train attacks;
infant bulging fontanelle coma seizures neck stiffness uncommon;
hope meet project have inspired growth project working ever since meningitis coma yrs ago lifegiving saving musical melodies thank;
cheryl woke weeks later personality changed had learn things adjusting new getting frustrated things thought could ease memory loss survivors guilt confusion denial much;
have dealt seizure coma meningitis twitchy pair symptoms;
snake bite patient still deep coma si tb meningitis nagwoworsen din di ko kaya magpedia guys;
two nde coma life around years surgical operation around years meningitis left immediately different places world exciting never forget;
two nde coma life around years surgical operation around years meningitis left immediately different places world exciting never forget;
britt confused meningitis hepatitis c okay;
years ago coma due meningococcal meningitis ultimately experiences shape us every thunderstorm comes rainbow must follow strength found inside didnt realise im forever grateful nhs;
rt gospaarts uno la oración yo pase por una meningitis con doce años y estuve meses en coma vamos conseguirlo recemos sin desfallecer fuerza esos padres y la pequeña via;
daughter born months visiting parents cait changed lives forever hydrosyphallicinstalled shunt meningitis put coma brain surgeries later year struggling alive;
confused types meningitis nma clears differences viral vs fungal vs bacterial;
had mono early guy had started dating told coworker had meningitis confused coworker kept saying sorry still funny years;
knocking personally distinction meningitis septicaemia crucial one yet confusion persists even senior levels;
thing gets story even senior levels theres still confusion difference meningitis meningococcal septicaemia spend lot time drumming distinction teams paediatrics;
collapsed one monday morning coma days could make bacterial meningitis brain healthy guy wonderful brother dad son;
meningitis coma siya karon;
meningitis coma;
health meningitis symptoms include sudden onset fever headache stiff neck symptoms include confusion student experiences symptoms immediately report pitts student health service hospital er;
pneumo meningitis coma days expiring;
sam ballard years old friends party dared swallow slug within days australian teen developed rare form meningitis fell coma lasted year even waking remains paralyzed neck;
performed fash showed splenic microabscesses indicative disseminated tb started empiric tx tb meningitis friday still febrile confused;
far st patricks day ive held two confused patients restrained exposed meningitis fml;
anyone following familys drama pray harder having survived coma days icu hospital negligence has made bid dads life first day regular room left alone fell had emergency brain surgery subdural hematoma last pm;
symptoms adults older kids headache stiffness vomiting bright lights pains patient may confused fitting episodes symptoms may appear;
fundraisers far medical emergency fund kenneth young stricken meningitis trip panama lays induced coma ny insurance cover country please read help retweet tx ng;
hello please read circulate plight chatham nys kenneth young coma panama flu turned meningitis flight family needs legal social medical diplomatic support thank ng;
family flew ny panama last week husband became deathly ill meningitis b time flight landed induced coma family stranded please forward admin social help read story ng;
please assist family husband became ill trip medically induced coma meningitis wife crippled late stage lyme arthritis children trying manage alone panama another adult child downs ny;
thank u much yrs ago given months live have resuscitated coma needed tracheotomy could talk fought meningitis endless near fatal sepsis had multiple itu stays somehow still xxx;
tragedy rugby player paralysed dared swallow slug party infected rat lungworm followed eosinophilic meningitis coma quadraplegia via;
tragedy rugby player paralysed dared swallow slug party infected rat lungworm followed eosinophilic meningitis coma quadraplegia;
answer ct first suspected meningitis papilledema findings confusion lp almost never results herniation brain have seen have seen years;
ليه اول يوم ليا ف الامتياز اشتغل انا وريهام نأمبج ع طفل عند fistula بين aorta iva ومفيش مكان له ف الرعاية وهيفضل كده لحد ما يarrestويموت والسرير اللي جنبه جاية ب convulsions ودخلت ف coma وfever وغالبا meningitis والمفروض اخد دلوقتي سيبرو prophylaxis;
listeriosis symptoms flulike first – fever ‚ muscle aches ‚ diarrhoea – bacterium gets nervous system ‚ become meningitis like ‚ including severe headache ‚ sore neck ‚ convulsions ‚ confusion loss balance;
headache fever malaise muscle pain bacteria cause meningitis causing stiffneck confusion severe headaches may may cause diarrhoea;
really cold full snow half went coma today looks like meningitis brain intensive care x;
condition had lead close spinal taps neurosurgeries brain lumbar spine have also experienced septic meningitis times have coded twice put induced coma days years;
confused types meningitis nma clears differences viral vs fungal vs bacterial;
dang caregiver coma pregnant meningitis sounds like have had rough physically;
symptoms meningitis often confused flu thus even important stay aware informed regarding deadly disease comomeningitisorg have planned lot activities around raising awareness meningitis;
twentyfive years ago coma having onset cascading organ failure had fungal meningitis given days live later told itd extremely unlikely could father kids fathered twins next year another kiddo four years later;
infection brain causing stroke mental confusion meningitis brain problems sensation weakness involvement eyes leading sight deterioration;
meningitis inflammation membranes around brain spinal cord called meninges common symptoms include fever stiff neck severe headache eye sensitivity vomiting extreme sleepiness confusion have questions reach pediatrician;
common symptoms meningitis include stiff neck high fever sensitivity light confusion headaches vomiting read;
would know red flag symptoms babies young children fever severe headache stiff neck confusion cold hands feet later stages rash seek urgent medical attention;
go sleep regarding alfie evans case terminally ill infant got meningitis one year old had go icu went coma docs said similar shit condition parents aint gonna make;
father got meningitis went coma drinking somebody elses crib party;
thanks heads contracted meningitis age coma weeks one lucky ill support anything help raise awareness terrible illness;
phone confused thinks facebook viral meningitis actually completely correct see u siri;
arthur rushed intensive care fell coma contracting bacterial meningitis arthur elliss runde leuchtende zentrale fläche mit vielen farben von dem objekt scheinen strahlen auszugehen;
picture also proves silently meningitis works everyone gets spots teddys main symptom sleeping general lethargy beautiful courageous boy mum anna shared beautiful photo baby recovering;
describe using viral meningitis headache stiff neck sensitivity bright light sleepiness nausea lethargy;
aware malpractice suits have actually read based assertions someone coma viral meningitis hilarious;
cst ahmed vifaaq died meningitis recruitment training already coma high fever treatment started ordered tough infection internal may allah bless vifaqs soul;
one brother best mates coma meningitis boy has rest life live life cruel best people hope pulls;
could viral meningitis like thatll put coma like botulism e coli act within hrs continue dayssometimes fatal also know long coma speed recovery official reports;
nope outside weed claims drugfree has done since sex pistol days suffer spinal meningitis child though came different mentally coma;
lungworm gave sam ballard infection brain fell coma days contracting eosinophilic meningoencephalitis – strand meningitis;
also coma days meningitis baby back efficient die had one hour later wouldve dilly dally diagnsing meningitis dead hear folks comas end differently;
longterm effects rocky mountain spotted fever longterm effects inflammation brain known meningitis leading seizures coma inflammation heart inflammation lungs kidney failure;
often wade talking utter nonsense eldest suffered bacterial meningitis months full coma full support nhs alive care get facts straight nhs has saved millions lives free;
top say thanks babe buy love ya suffering brain damage coma meningitis tell complete strangers love em omg show cant help hahahaha;
thank yes even know virus almost killed coma respirator almost three weeks icu little months had meningitis encephalitis awful took full year pt able;
really feeling good today one classmate critical condition coma due meningitis heal fast praying;
got reason thoroughly confused meningitis focus makes sense since didnt otherwise care healthcare;
yesterday morning mom sent text saying umma good shape coma state explains due meningitis old age also see renal failure;
davide morana initially diagnosed flu less week later put induced coma had limbs amputated suspect trust instincts seek urgent medical attention;
photo vetted man died went heavan met people become quite expert trust somebody has died mom told always going different having meningitis coma days mo;
one time worked woman became nonverbal had meningitis germany pregnant years old delivered baby slipped coma;
disease often killing causing serious damage within hours days took day cousin coma maybe wouldve known meningitis isnt always show rash morgan would still alive today morgan had flulike symptoms sensitivity;
watch video tweeted way brain could have created experience guy had coma brain completely shut bacterial meningitis;
awake past yearsok minus night sleep day spinal meningitis coma decades ago baffled recent influx entitled white people claim woke seem use word admit have political coma rest lives;
actually coma meningitis left permanent peripheral neuropathy lower left leg footbut thanks crash largely caused looseygoosey mortgages fannie mae fed mortgage bank;
husband state mind thinks opoids ruined brain yrs lyme untreated viral meningitis yes get confused lose memory im moving still wish had pain pill bad days;
harriet contracted bacterial meningitis teenager know happening next thing remember brought induced coma click read story graphic account meningitis feels like;
note parent watch disturbing episodes involving abduction murder children child coma meningitis especially;
have headache fever feel dazed confused go see doctor immediately may have meningitis;
grew abandoned suffered brain damage due meningitis remember had fever delirious bloody handprints vomit everywhere reached picked something pink floor inside cheek;
normally sudden coma could due sudden brain haemorrhage stroke trauma infection like meningitis continuous seizures etc cant make diagnosis without access medical records;
think meningitis jab first one arm had fine im confused;
leilani induced coma one minute fine fell asleep next would wake called doctor diagnosed meningitis said know wake please pray send best wishes;
campaña solidaria todxs por martin martín de años alumno de la escuela especial n ° de presidente perón se encuentra internado en el hospital de guernica con meningitis en estado grave y en coma;
consider complications meningitis paralysis coma death brain swelling scary;
severe bacterial meningitis had higher brain activity doctor cared says coma medically induced patient conscious though hallucinating sounds like doctors peers described earlier side;
please say prayer brother former royal marine officer turned last month yesterday medically induced coma hospital lampang thailand teaches english drs think mightve spinal meningitis thats;
meningitis severe allergic reaction causing symptoms spanning itching swelling trouble breathing convulsions shock coma;
yet another article featuring dear friend zyp contracted septic bacterial meningitis two years ago coma months lost legs knee holy shit still obnoxious actors;
would think alison ettels near death experience coma due meningitis would have different outlook life ie compassion kindness self reflection still hasnt learned lesson universe tried teach;
google search lady right suffered meningitis went coma lost memory suffered constant panic anxiety since tries deal help others deal one day deal well ended;
cant imagine remarkable story irish sport year james burke put induced coma easter bacterial meningitis couple months later scores points play christy ring cup winning team inspirational well done young man;
topomax also antiseizure med brain swollen year infection got bit tick had viral infection meningitis viral bacterial although get lymes spinal fluid almost killed coma;
answer person survive deep coma meningitis;
old stephen usually fit well severe headache lethargy aching muscles sensitivity light struck april knew something serious wrong read story;
months placed induced coma bacterial meningitis james burke lines wing forward hurlers tomorrows christy ring cup final v wonderful comeback have great day;
kildares james burke shares fantastic story comeback induced coma diagnosed bacterial meningitis five antibiotics put induced coma full interview hurling;
earlier could feel coming something googled symptoms meningitis theyre confusion headache fever sore throat saying have meningitis have last also forgot friends name minutes tonight;
patient meningitis fully prepared relatives friends behave good age time ill l coma months since time l have friend relatives help condition relatives friend please suggest;
thinking might need mri soon have had one since had meningitis feel coma whoever god pray;
harvard neuroscientist dr eben alexander said saw heaven sevenday coma brought bacterial meningitis e coli bacteria eating brain experience happened said;
week years ago since daughter died meningitis going coma months around time know thankful has brought moment life;
week years ago since daughter died meningitis going coma months around time;
contracted bacterial meningitis could breath put respirator places medically induced coma pumped full antibiotics;
viral meningitis grade expect survive first night coma let alone following four days;
liked video medically induced coma recovery meningitis testimonial;
get mmr shot hpv shot meningitis fatal easily spread confused whats end illegal;
bacterial meningitis isnt subtle affliction gets fatal symptoms days death sufferer experiences extreme pain visibly sick disoriented confused nonresponsive fever dehydration vomiting;
romero died bacterial meningitis medical examiner found romero wld have appeared disoriented confused nonresponsive illness progressed mental deterioration wld have become immediately obvious observer;
neuro surgeon day coma contracting meningitis relates interesting info;
neuro surgeon day coma contracting meningitis relates interesting info;
havent worked yrs cognitive disfunction depends amount strain ct med mj patients legal drive functional ive sick since meningitis cant say causes confusion;
este tiene de efectos secundarios hemorragias acv coma meningitis taquicardia infarto asi que podria ser peor jajaja;
person dead died bacterial meningitis left shell depression sadness pain pain confused dizzy ass bitch aint good im back dark place;
tell doctor ive medical care year dizziness confusion migraines chronic neck pain since bacterial meningitis im scared pull license medical reasons might good idea;
have waiting meningitis shot hour leaving work confused insurance gonna late;
pues mientras hablamos una chiquilla adolescente conocida de mi surfero está en coma inducido por culpa de una fulminante meningitis c se rompe el corazón pensando en ella y en sus padres;
complications rare virus spreads intestines central nervous system patient get viral meningitis viral encephalitis confusion seizures coma;
child coma currently quezon city general hospital meningitis;
csections gall bladder removed meningitis weeks coma months hospital kidney cancer had one kidney removed diabetes meds cost;
please dont worry healthcare menorca saved life having meningitis septicaemia spending week coma spanish healthcare good please remember ehic card have probs have spain enjoy ur holiday;
c sections meningitis weeks coma kidney cancer one hospital two monthsprice nothing perfect us would probably dead;
tragic final text teen died meningitis slipping coma music festival;
meningitis teenagers tragic final text sent friend minutes slipped coma died;
meningitis teenagers tragic final text coma;
meningitis teenagers tragic final text sent friend minutes falling coma;
yesterday heard child went sleep went coma without waking bali ginavi varakah vote olhuvaalumaai naajaizkoh baaruge beynun kuramundhaa dhiyumah visnaane vaguthu madhuvaane sihheefaruvaa hoadhaa meehun ginave ethanthanah faidhaa boduvaane;
confused child had meningitis wasnt showing symptoms passed along get meningitis vaccine;
rob know experience has c sections gall bladder removed meningitis weeks coma time kidney cancer one removed add price complaints alive talk;
confused hours child vaccinated contracts meningitis side effect vaccines miraculously caught unvaccinated child sorry calling bs one even get vaccinated;
hearing several days neighbour checked family found modigliani bed delirious holding onto hébuterne doctor summoned modigliani final stage disease died meningitis january aged;
go mate cousin went one wasnt chlorinated enough got ear infection later went coma hours later cerebral meningitis;
please keep year old goddaughter prayers hospital docs sure wrong confused may have had seizure possibly meningitis tests forthcoming;
cincinnati dayton mine bacterial meningitis coma;
closest dearest friend wife coma bacterial meningitis wife mother beloved teacher please help via;
hb saved mothers life kept alive coma have continued supported post meningitis recovery learning hear w cochlear implants walk brothers could never have afforded;
confused types meningitis nma clears differences viral vs fungal vs bacterial;
old educater london wife left meningitis hours stretcher till coma said nothing taken private care live another years;
days ago uncle diagnosed bacterial meningitis put life support induced coma effort help heal yesterday doctors informed us;
ten years ago went doctor flu sent hospital make sure wasnt serious eight hours later induced coma discovered meningitis saved life incredible institution made incredible people;
wasnt would have died born got meningitis hospital wasnt meant live night went coma diagnosis;
four years ago life saved nhs placed coma due meningococcal meningitis nhs rebuilt gave strength supported family made feel safe im forever grateful salute every single one;
eventful years uni contracting meningitis placed coma say graduating english;
happy birthday nhs two months ago got call say dad critical care coma had meningitis septicimia doctor said had hours live nearly three weeks later woke month home;
seem confused meningitis highly deadly untreated initial symptoms vague difficult differentiate minor illness preventable deaths thanks vaccine thats even counting hib various potentially deadly illnesses;
wife sent home rash diagnosed allergy lemsip collapsed hours later rushed hospital meningitis coma days completely blind profoundly deaf result agree nhs needs money needs reforms money;
boardmasters festival medics left teenager coma tent floor died meningitis;
medics boardmasters festival left boy coma tent floor told mum pay taxi take hospital died meningitis report found;
music festival doctor told mother sons rash emergency slipped coma died meningitis;
boardmasters festival medics left teenager coma tent floor died meningitis scottish daily record;
teenager left floor boardmasters festival medics falling coma dying meningitis;
medics boardmasters festival left bristol boy coma tent floor shortly died meningitis has revealed;
medics boardmasters festival left bristol boy coma tent floor shortly died meningitis has revealed;
thats called metanxities confused meningitis;
years ago found have cancer one kidney guess coma day meningitis believe dr had cancer showed exrays had believe told pain thought would happen one kidney removed;
coma dying meningitis someone played end linkin park woke tell turn;
vaccinated children grandchildren vaccinated problems meningitis vaccine had came son born doctor asked said yes saw meningitis mom walker dementia coma nearly months;
three years ago had meningitis coma two weeks coma cancer detected spending month hospital recovering meningitis strong enough have surgery yo remove cancer total cost;
confusion comments large numbers teenagers have received meningitis w vaccine england;
used routine immunization schedule recommendations meningitis b vaccine category recommendations used causes lot confusion learn permissive use;
ny affecting raccoons has spinal meningitis great white sharks had symptoms confusion spasms shaking losing coordination dogs contract hopefully theyre figuring ou;
best friend contracted meningitis serious one coma nearly died parents jehovah witness refused blood transfusions son deaths door religion mess never stand mess;
also meningitis acwy vaccine confused ones have;
symptoms west nile virus include fever confusion muscles weakness severe headache serious complications include neurological illnesses meningitis encephalitis;
symptoms west nile virus include fever confusion muscles weakness severe headache serious complications include neurological illnesses meningitis encephalitis;
grandson placed induced coma contracted meningitis expected survive mum identical twin sister sang nothing rap r always loved senior staff nurse remains convinced pulled back;
son had meningitis septacemia months old rushed surgery snooty receptionist turned away got home phoned doctors doctor rushed straight house within mins blue lighted hospital coma days luckily made;
home currently bedrest had really bad seizure helped us find have meningitis contagious suffering weakness confusion little time ton updates yall thnx everything uve – st marks hospital;
though human infection often involves symptoms rat lungworm spread brain cause meningitis neurologic deficits coma death thanks helping week get great relaxing start;
nakauwi rin span brian tumor hyponatremia hypernatremia pneumonia seizures dehydration meningitis coma steven johnsons syndrome septicaemia salamat sa;
intracranial hypotension myth say lindagraymd dural enhancement brain mri specific finding intracranial hypotension due confused w meningitis malignancy;
angiostrongyliasis nematode cause eosinophilic meningitis coma death has recognized southern us ⁦ ⁩;
coma days meningitis nearly killed have liaisons brain deadly get vaccinated get kids vaccinated;
particular refer case like much reductive material worldview experience occurred coma brain shut bacterial meningitis;
life changed well viv contracted meningitis coma weeks medics fought save life left significant limb loss video talks impact had life since;
body feels sick sore mental cooling confused maybe meningitis idk dont have time;
since coma years ago suffering meningitis sepsis brain tumour husband aided recovery fitbit hes walked steps minimum every day since;
show support many aware local hindley boy harley edwards taken seriously ill last week meningitis harley induced coma unwell;
daily bread way kamil joelle devastated eightyearold daughter rima diagnosed rare form leukemia disease led meningitis stroke rima lapsed coma hospital;
looks interesting almost finished proof heaven dr eben alexander quick read near death experience meningitis resultant coma one week;
kellys set actor donald sutherland contracted spinal meningitis went coma expected die sutherland made full recovery continued filming;
kamil joelle devastated eightyearold daughter rima diagnosed rare form leukemia disease led meningitis stroke rima lapsed coma hospital medical team;
via daily bread kamil joelle devastated eightyearold daughter rima diagnosed rare form leukemia disease led meningitis stroke rima lapsed coma hospital medical team;
way kamil joelle devastated eightyearold daughter rima diagnosed rare form leukemia disease led meningitis stroke rima lapsed coma hospital medical team counseled pa;
way kamil joelle devastated eightyearold daughter rima diagnosed rare form leukemia disease led meningitis stroke rima lapsed coma hospital medical team counseled;
still better stiffnecked confused looking man like one suffering meningitis;
also made clear said meningitis polio renamed thing clear confused person;
spite rapid advances immunization still produces significant confusion anxiety hcps via;
harley currently induced coma alder hey childrens hospital liverpool;
