Tweet;
darker horizons indeed life changing life ending cases suggestions us included meningitis scarlett fever slapped cheek syndrome settling wrongly measles correct diagnosis came post mortem sadly spotting signs sooner has top priority;
mean read story said cant say shes basically saying like high fever symptoms would have come meningitis virus got shot doc prob said ya fine vaccines shut;
never had flu never get strep sho enough ive had pneumonia pleurisy meningitis scarlet fever;
spotted fever rickettsiae tuberculous meningitis dual infection presenting acute encephalitis abstract;
have fever n good hypochondriac lives city gets meningitis outbreaks way normal;
im heavily exposed meningitis flu tb measles etc least work havent had much low grade fever even years thanks vaccines;
woah meningitis must have scary had scarlet fever kid also would have likely starved death could take soy formula infant thats ways never would have survived like;
have take fluconozale rest life company stopped making charging reasonable price one producerthey jacked price medicare extra pres pkg copay months moral get valley fever meningitis;
strange deaths connected meningitis flu yellow fever vaccine via holly;
better measles proff have prove vaccines made go heterosexual tbh id rather heterosexual contain hepatitis b measles meningitis mumps pertussis poliomyelitis rubella tetanus tuberculosis yellow fever;
added video playlist strange deaths connected meningitis flu yellow fever vaccine;
added video playlist strange deaths connected meningitis flu yellow fever vaccine;
liked video strange deaths connected meningitis flu yellow fever vaccine;
aware signs symptoms meningitis common signs symptoms meningitis include fever rash stiff neck get medical help immediately someone unwell learn;
strange deaths connected meningitis flu yellow fever vaccine;
strange deaths connected meningitis flu yellow fever vaccine via;
yeah might flu have similar symptoms sudden fever scared might meningitis;
strange deaths connected meningitis flu yellow fever vaccine;
like shots think twice booking trip africa heres minimum needvaccinations travel tetanus diphtheria polio typhoid hepatitis hepatitis b yellow fever rabies meningitis get started;
المواضيع المطروحة لهذا bacterial meningitis palsy myopathies liver disease fever infective endocarditis;
least eresistante tb echagase disease ehive hepititis ae edenguee fever ehantaviruse malaria meningitis virus children exposed many deaths many permanently crippled;
great article nejm months ago patient neck stiffness fever had rapid downhill course mentioned google symptoms common hundreds diseases get nowhere google fulminant meningitis get diagnosis;
had cold hands feet severe headache fatigue fever dislike bright lights nausea would think possible early symptoms find meningitis signs symptoms following;
unyielding fever days ate today concerns dr hours cause kids never tank day great planning said get checked meningitis nope whew fever still high want one wrap saran wrap lose weight;
patients fever neck stiffness meningismus ill appearance photophobia severe headache excessive somnolence undergo lumbar puncture;
im sick have high fever headache neck stiff dont know fibromyalgia have meningitis latter lets hope dont die;
had headache neck stiffness fever diagnose meningitis ami told headache due staring mobile continually neck stiffness due keeping neck position hrs fever warm forehead due staying bed long;
hepatitis hepatitis b typhoid cholera yellow fever rabies meningitis polio measles mumps rubella tdap diphtheria chickenpox shingles pneumonia influenza;
meningitis fever headache neck stiffness;
nephew admitted hospital since last friday due high fever sometimes has hallucination check doc said have meningitis need stay hospital hope recover soon discharge earlier;
get meningitis younger get really bad fever cooked have always extraordinarily stupid entire;
yes confirm new born less weeks old runs fever spinal tap necessary rule meningitis;
cold hands feet severe headache fatigue fever dislike bright lights nausea possible early signs meningitis acts fast kill hours know cksymptoms;
came er thursday night admitted severe head neck painshakessweatsand fever diagnosed strep possible meningitis spinal tap went horribly wrong yesterday entire spine pain idk anymore;
burden emergency clinician consider every child presenting fever vomiting irritability headache neck pain photophobia altered mental status seizure focal neurologic findings purchase;
misdiagnosed flu actually had meningitis almost died vaccine avail young get vaccine high fever had resulted becoming deaf today have vaccines strains docs better trained diagnose;
dehydration malnutrition newborn period scarlet fever month old made past would certainly have meningitis age threeandahalf;
probably one meningitis rheumatic fever measles chicken pox various infected cuts undiagnosed high fever grateful uk nz health systems;
scarlet fever months old meningitis years old miscarriage complications childbirth partially retained placenta think could have beens sometimes wonder;
send vaccination list visiting nirvana hepatitis hepatitis b typhoid cholera yellow fever japanese encephalitis rabies meningitis polio measles mumps tetanus diphtheria influenza shingles miss;
become seriously ill less hours yellow fever vaccine got raging meningitis hospitalised week uch unwell month tests investigations proved link remain convinced causal effect;
have idea tested positive strepbut symptoms besides shakessevere painand fever want spinal tap meningitis;
months old due degree fever meningitis had survived probably something related really messed eyesight;
people urged watch symptoms meningitis early symptoms include fever headache vomiting diarrhoea muscle pain stomach cramps fever cold hands feet rash;
weeks dpt hib hepatitis b pneumonia otitis media months vitamin months measles yellow fever months meningitis septicemia vitamin polio months measles mumps rubella chicken pox;
had neurologist tell fever symptom neurological illness gee guess things like meningitis really exist either;
honestly headaches slight fever ebola have also had fear meningitis brain;
diseases alone tb diptheria pertussis measlesflu dengue fever meningitis disentary etc;
had cold hands feet severe headache fatigue fever dislike bright lights nausea would think meningitis possible early symptoms find cksymptoms;
self medication never advised report health facility experience unexplained high fever recovery guaranteed early treatment dr olaolu aderinola ncdc;
symptoms accompany fever headache neck stiffness nausea vomiting sensitivity light effective cure prevention best dr olaolu aderinola ncdc;
thought had meningitis severe headache fever vomiting bypassed paediatrician took directly uhwi e didnt suspect dengue hospital consider dengue time given iv fever broke sent home;
meningitis real possibility antibiotics steroids clear good part wasted time getting er good job hope theyve given popsicle start bringing fever;
article mofidi et al jolt accentuation value sign diagnosis meningitis patients fever headache full;
dont put stuff often im hospital sage spiked fever cant move neck testing meningitis among things good spirits even made mom leave cowboys put sleep;
vaccines altered year whole cell acellular big difference nuisance side effects fever sore remember days meningitis blood sepsis never want see cannot know helpless pain dying;
years old boy fever headaches vomiting oral amoxicillin improved admitted csf leucocytes mm neutrophils lymphocytes csf erythrocyte nil csf protein csf glucose mmol l partially treated meningitis;
part studying med growing fever headache checking every minutes see whether fill rest criteria bacterial meningitis;
cdc recommend following vaccinations hepatitis hepatitis b typhoid yellow fever rabies meningitis polio measles mumps rubella tdap diphtheria chickenpox shingles pneumonia influenza;
【 不運なmanage 】 不運にも 、 不幸にも 〜 する managed annoy everybody managed make mess whole thing twin brother contracted usual childhood illnesses managed add scarlet fever diphtheria meningitis;
easy vaccines come deaths due influenza meningitis measles mumps yellow fever rubella tetanus tuberculosis get completely wiped;
triad meningitis fever neck stiffness mental status change;
us sadly diagnosis came post mortem visit dr sent us home told stay worried nurse paed registrar went meningitis scarlett fever slapped cheek fyfths disease measles matron refused admit ward without diagnosis;
eadde ethee travel estuffe like etetanuse diphetheeria hepatitis aebe eande e etyphoide rabies pertusssis meningitis ece herpes ezostere fsme yellow fever hpv epolioe eceholera japanese encephalitisb tuberculosis etickeborne encephalitis rota ehiebee;
find sudden death flu meningitis sketchy ive had including needing spinal tap stop fever didnt happen suddenly something isnt right;
young lady seen high fever meningitis sad;
actually biggest hypochondriac googling meningitis symptoms bc have fever;
oh trust praying isnt meningitis neck soar fk even running fever ib;
meningitis septicaemic rash have shown unless meningitis without rash vomiting undeniable fever diagnostically indistinguishable daytoday misery;
tweet pm wed eve show know show thursday found barely breathing unresponsive hospital worked hours say scan testing determine possibly meningitis fever;
bacterial meningitis flu start fever malaise progress respiratory distress failure meningitis rare deadly mimics flu added symptoms severe headache stiff neck;
supposed go hospital have fever stiff neck make sure meningitis;
stiff neck addition flulike symptoms could key clue diagnosing meningitis;
stiff neck addition flulike symptoms could key clue diagnosing meningitis;
meningitis inflammation protective membranes covering brain spinal cords causing headache fever stiff neck rare resulting fewer cases per year spread airborne droplets usually shortterm;
asemumase asewhoase lost aseherase asedaughterase asemeningitisase year ago asewantsase aseparentsase aseandase teenagers learn asethease signs wendy yates didnt realise having stiff neck clue joanna had disease;
weeks acquaintance mine complained stiff neck fever migraines selfmedicated painkillers never got better suspected meningitis yestrdy suggested lumbar puncture da results confirmed suspicion wish speedy recovery;
have had stiff neck headache hours convinced have got meningitis;
meningitis get serious quickly seek medical care experience high sudden fever severe headache stiff neck nausea vomiting;
stiff neck แบบไม ่ ต ้ อง meningitis;
meningitis inflammation membranes surrounding brain spinal cord swelling meningitis triggers fever stiff neck cases meningitis caused viral infection bacterial fungal infections causes;
stiff neck relentless anxiety have convinced ive come touch meningitis;
having trouble sleeping weird leg has blood stiff neck meningitis headache seizure;
kind crap put anxious people totally had meningitis yesterday had stiff neck tension headache went away kind didnt have meningitis;
used have case study diagnosed bacterial meningitis gladly accurate yay knowing signs symptoms like stiff neck omg stiff neck have hahahahahaha omg kidding aside hehe pero truly panicked telling;
health meningitis symptoms include sudden onset fever headache stiff neck symptoms include confusion student experiences symptoms immediately report pitts student health service hospital er;
had meningitis thats reason im saying stiff neck symptoms keep eye temperature doctor call maybe get sounds like something viral anyway poor thing;
dr meningitis dx poor sensitivity fever stiff neck ams had classic triad fever had least add ha none move;
have given stiff neck sitting bed working yesterday either contracting meningitis hopefully later;
oh see had going kalingalinga clinic two weeks complaining headache stiff neck kept giving panado taken levy general discovered actually meningitis tried lumbar puncture died;
stiff neck caused meningitis;
lmfao googled stiff neck have bacterial meningitis;
common symptoms meningitis includes high fever headache vomiting stiff neck dislike bright lights children also become drowsy unresponsive sometimes may experience fits seizures;
stiff neck addition flulike symptoms could key clue diagnosing meningitis;
stiff neck addition flulike symptoms could key clue diagnosing meningitis;
have having headaches stiff neck lately googled symptoms turns have meningitis;
able recognise symptoms meningitis crucial symptoms fever rash vomiting headache stiff neck sensitivity light drowsiness comomeningitisorg have planned lot activities around raising awareness meningitis;
woke stiff neck pretty sure means im dying meningitis google told;
meningitis inflammation membranes around brain spinal cord called meninges common symptoms include fever stiff neck severe headache eye sensitivity vomiting extreme sleepiness confusion have questions reach pediatrician;
world meningitis day learn recognize symptoms headache fever stiff neck first hours crucial;
have stiff neck today reminds time high school complained mother neck stiff head ached said could meningitis kills hours guess well know;
common symptoms meningitis include stiff neck high fever sensitivity light confusion headaches vomiting read;
would know red flag symptoms babies young children fever severe headache stiff neck confusion cold hands feet later stages rash seek urgent medical attention;
meningitis hard recognize early stages symptoms similar common flu main symptoms look fever vomiting headache stiff neck sensitivity light drowsiness altered consciousness;
know whether headache stiff neck cause meningitis slept much hmmmmm maybe;
todays intrusive persistent headache stiff neck probably meningitis kill embarrassing have yet finished work project people find die;
feeling sick severe headache stiff neck skin get doctor quick meningitis;
read online accounts broken engagements identifying signs symptoms heart pounding way wake stiff neck read meningitis page webmd;
read online accounts broken engagements identifying signs symptoms heart pounding way wake stiff neck read meningitis page webmd;
read online accounts broken engagements identifying signs symptoms heart pounding way wake stiff neck read meningitis page webmd;
describe using viral meningitis headache stiff neck sensitivity bright light sleepiness nausea lethargy;
type headache sore throat stiff neck google first diagnostic pops viral meningitis;
need rule remember relationship eg fever stiff neck bacterial meningitis rules fail eventually rare patient postop cervical osteomyelitis presents fever stiff neck;
fever severe headache stiff neck leading symptoms meningitis tell bacterial spot warning;
hate have sort medical knowledge cause whenever im super sick have stiff neck think im gonna die meningitis;
stiff neck addition flulike symptoms could key clue diagnosing meningitis;
stiff neck addition flulike symptoms could key clue diagnosing meningitis;
yes miserable scared had meningitis fever stiff neck;
neurological complications often occur second stage lyme disease numbness pain weakness bells palsy facial visual disturbances meningitis symptoms fever stiff neck severe headache;
every time get stiff neck become convinced have meningitis going die;
last night auntie lisa taken life support battling meningitis days meningitis serious illness contracted everyday behaviors ever experience high fever stiff neck horrible head ache pls seek medical;
looked causes stiff neck meningitis popped upumm byeee;
important notice knowing going benefit huge boon drug company suddenly putting statins water know patients fever stiff neck need antibiotics — ones meningitis;
stiff neck addition flulike symptoms could key clue diagnosing meningitis;
stiff neck addition flulike symptoms could key clue diagnosing meningitis;
according csupueblo community text messaging service possible case bacterial meningitis has reported contact health provider exhibit three fever stiff neck headache;
ugh every time have stiff neck start panicking think might have meningitis;
ive got stiff neck probably have meningitis something beginning;
stiff neck sign meningitis fyi never know;
meningitis symptoms stiff neck fatigue nausea vomiting youre having;
woke stiff neck bad headache u have meningitis sleep weird have world may never know;
stiff neck flulike symptoms could key clue diagnosing meningitis;
stiff neck flulike symptoms could key clue diagnosing meningitis;
mollarets meningitis recurrent selflimiting meningitis commonly caused episode accompanied fever stiff neck photophobia severe headaches lasting days unfortunately clear evidence;
medical field cool wake stiff neck have convince dont have meningitis;
hypochondriac also stiff neck symptoms meningitis;
someone reads drivel thinks kid has stiff neck taurean turns meningitis know whataboutism also foreseeable know better apologize pushing;
neck soreit better meningitis better sore stiff neck;
physical signs seen 《 meningitis fever mental status chang pulse rate stiff neck kernigs sign brudzinski sign fundoscopy papilledema peticheal haemorrhage;
past three days ive waking terrible stiff neck eases day goes definitely meningitis have meningitis;
ive had headache days stiff neck im trying tell meningitis;
r u god pneumococcal meningitis infection tissue covering brain spinal cord symptoms stiff neck fever headache photophobia sensitive;
god pneumococcal meningitis infection tissue covering brain spinal cord symptoms stiff neck fever headache photophobia sensitive;
dont see stiff neck symptoms thats must meningitis;
first musawo wa babe meningitis would talking having stiff neck forever think immunised cause viral bacterial even fungal causes;
meningitis fatal seek medical advice have symptoms stiff neck aversion light see;
must getting old younger stiff probably slept weird stiff neck hour dinner welp meningitis probably try enjoy last meal;
every time have headache stiff neck convince meningitis ill probably die soon;
stiff neck nasal congestion nausea vertigo hopefully meningitis let get opinion fine stop annoying take paracetamol message better meningitis going die;
have really stiff neck results brain zaps bend head go er immediately thought had flu nope meningitis confirmed spinal tap felt good enough venture;
bacterial meningitis cause inflammation brain according centers disease control prevention symptoms include fever headache stiff neck;
ever get stiff neck worry sec might have meningitis;
bacterial meningitis cause inflammation brain according centers disease control prevention symptoms include fever headache stiff neck nstateofficialsconfirmcaseofbacterialmeningitis;
watching dude had stiff neck mind like probably has meningitis doctor says might have bacterial meningitis doctor wow hit medical;
every time wake stiff neck assume have contracted meningitis await swift death;
according good doctor patient oral abscess stiff neck has bacterial meningitis within reason least exam support clinical decision;
ive had stiff neck day either have meningitis cancer muscle strain;
lmk look stiff neck remedy meningitis pops google really got anxiety sky rocketing yo;
has slightly stiff neck having fever night meningitis youre dying google things;
took ill thursday night london pal throwing non stop temp n heart rate had crazy headache n stiff neck treating meningitis need scan n spinal tap confirm waiting day nightmare;
remember injuring neck wary meningitis stiff neck symptom sorry mean scare;
studying meningitis having massive headache stiff neck time;
googled symptoms had meningitis really tried tell had stiff neck wlh;
kid woke stiff neck grandpa freaked took dr told go hospital bc might have meningitis got spinal tap absolutely reason sums entire existence;
symptoms viral meningitis include fever severe headache stiff neck sensitivity bright lights drowsiness confusion nausea vomiting;
meningitis b many people carry enters bloodstream disseminates cause harm rapid illness early fever headache stiff neck deteriorates fast dangerous fatality meningitis;
oh ya u have get checked im sure nothing ik stiff neck symptom meningitis;
watching good doctor disease cards guy had stiff neck thought huh early sign bacterial meningitis dr said stiff could sign bacterial meningitis feel smart;
found around someone diagnosed viral meningitis also have had stiff neck days;
ever get meningitis screwed get stiff neck everytime get sick going full batman today;
dr clinically had rash stiff neck blood test came back positive meningococcus meningitis mortality morbidity high lose sight trouble hearing use steroid days decrease inflammation;
occasionally red eyes stiff neck light headedness headache kiasi times huwa meningitis;
having stiff neck past days ya boi even worried possible meningitis hypertension ya bois freakin worried;
think really meningitis see doc asap thats serious life threatening symptoms stiff neck headache fever confusion rash nausea irritability meningitis affects brain spinal cord hope feel better soon;
meningitis hard recognize early stages symptoms similar common flu main symptoms look fever vomiting headache stiff neck sensitivity light drowsiness altered consciousness;
early symptoms meningitis may appear mild similar cold flu symptoms progress quickly may include severe headache sudden fever stiff neck vomiting confusion rash schedule appointment chsportalsalemstateedu protect;
meningitis rare serious disease lookout signs stiff neck sometimes makes hard touch chin chest confusion headache high fever nausea vomiting discomfort bright lights seizures;
suddenly stiff neck reason gonna die meningitis;
spinal tap told dont have meningitis depression would get stiff neck cold hands fever similar meningitis;
make sure have meningitis fam fever stiff neck nausea sensitivity light chills etc stiff neck kinda associated meningitis feel really really sick;
flu usually gives runny nose cough chest cold usually kill meningitis hand deadly early signs meningitis include headache fever stiff neck beware;
wakes stiff neck med student meningitis;
sent home urgent care had stiff neck two days later had back pain walking went er diagnosed meningitis neck never really stiff;
always believed had meningitis had stiff neck killer headache tho;
had meningitis healthy day would have extremely sick coughing sneezing vomiting fever chills body aches stiff neck horrible migraine etc something wrong picture;
learning death reported flu possible meningitis please share urgency seeing doctor have fever severe headache stiff neck meningitis home cdc exhtml via;
had friend died way young years ago undiagnosed case meningitis sadthis stuff has symptoms stiff neck one make sure get checked stiff neck;
cannot stress enough anyone know developes extreme flu symptoms within hours unbearable fatigue head splitting migraines stiff neck fever please go hospital case meningitis kill;
common signs symptoms meningitis fever vomiting drowsy confusion irritability severe muscle pain pale skin severe headache stiff neck;
feel like have lobar consolidation lungs cuz pneumonia meningitis cuz stiff neck headache sensitivity light holy shit;
looking remedies stiff neck google telling might meningitis;
googled symptoms ways help stiff neck google really gonna tell have meningitis;
dr patient has stiff neck might have meningitis;
worried worse gastroenteritis woke stiff neck morning uncommon worse could viral meningitis feeling better going clinic hospital get checked;
son had meningococcal meningitis symptoms like flu hours collapsed hard detect have stiff neck light sensitivity spent days icu another days hospital;
meningitis inflammation membranes surrounding brain spinal cord swelling meningitis typically triggers symptoms headache fever stiff neck;
ward round yrold steroids admitted diarrhea stiff neck coma xray bacterial meningitis strongloides larvae strongyloides hyperinfection secondary bacterial meningitis beware steroids se;
dad always asked sick kid old brother had viral meningitis kid whenever get headache stiff neck still little check sure;
j have sore throat headache stiff neck mean have meningitis;
im usually paranoid sick reason anytime have stiff neck immediately conclude have bacterial meningitis going die;
aware signs symptoms meningitis common signs symptoms meningitis include fever rash stiff neck get medical help immediately someone unwell learn;
have bad headache stiff neck either have meningitis shoveling;
bro lot people check stiff neck tell tale meningitis assessing listeriosis catch late die south africa;
friend have stiff neck have meningitis friend friend know one symptoms meningitis stiff neck holding friend know one symptoms dumb bitch overthinking friend holding one;
keep getting anxious stiff neck cause meningitis;
going get hot stone massage try get rid stiff neck still stiff massage im going accept have meningitis quarantine;
stiff neck due having have meningitis going die;
have headache stiff neck likely slept last mind goes straight meningitis;
downside student nurse headache stiff neck shoulders really tired likely cold brain meningitis learn stress;
tell told infectious disease dr catch virus way bodily fluid exchange sneezing coughing etc mine started flu symptoms wednesday friday coma viral meningitis has similar symptoms including stiff neck;
news year get hypochondriac ass stiff neck rampant fears meningitis;
